{
  "formatVersion": 1,
  "id": "town",
  "name": "Stadt",
  "tileSize": 32,
  "width": 4,
  "height": 4,
  "layers": [
    {
      "name": "ground",
      "width": 4,
      "height": 4,
      "tiles": [1, 1, 1, 1, 1, 1, 1, 1, 1, 1, 1, 1, 1, 1, 1, 1]
    },
    {
      "name": "collision",
      "width": 4,
      "height": 4,
      "tiles": [0, 0, 0, 0, 0, 1, 1, 0, 0, 1, 1, 0, 0, 0, 0, 0]
    }
  ]
}
